{
    "id": "hv3JuDGx",
    "projectName": "Explosif",
    "link": "https://cnft.io",
    "twitter": "https://twitter.com/Explosif_io",
    "category": "MARKETPLACE",
    "subCategory": "NFT",
    "description": {
        "short": "Explosif (formely CNFT.IO) is a marketplace for Cardano Non-Fungible Tokens, launched in July 2021, the first marketplace on Cardano blockchain"
    },
    "releases": [
        {
            "releaseNumber": 1,
            "releaseName": "V1",
            "scripts": [
                {
                    "id": "0j8R8c",
                    "version": 1
                }
            ]
        },
        {
            "releaseNumber": 2,
            "releaseName": "V2",
            "scripts": [
                {
                    "id": "0j8R8c",
                    "version": 2
                }
            ]
        },
        {
            "releaseNumber": 3,
            "releaseName": "V3",
            "scripts": [
                {
                    "id": "0fm9UZ",
                    "version": 1
                },
                {
                    "id": "70V28B",
                    "version": 1
                },
                {
                    "id": "VCuTLw",
                    "version": 1
                },
                {
                    "id": "116Z4E",
                    "version": 3
                }
            ],
            "contractId": "lADw"
        }
    ],
    "contracts": [
        {
            "openSource": true,
            "contractLink": "https://github.com/Canonical-LLC/cnft-io-marketplace",
            "contractId": "lADw"
        }
    ],
    "scripts": [
        {
            "id": "0j8R8c",
            "name": "Marketplace",
            "purpose": "SPEND",
            "type": "PLUTUS",
            "versions": [
                {
                    "version": 1,
                    "plutusVersion": 1,
                    "fullScriptHash": "71a27b0572bf383c751e13597a600538e465bf9f4eb2df497b15101b27",
                    "scriptHash": "a27b0572bf383c751e13597a600538e465bf9f4eb2df497b15101b27",
                    "contractAddress": "addr1wx38kptjhuurcag7zdvh5cq98rjxt0ulf6ed7jtmz5gpkfcgjyyx3"
                },
                {
                    "version": 2,
                    "plutusVersion": 1,
                    "fullScriptHash": "71483788748bd6129043bfc87fba9c0b5bc7e49b892efdc9dd783e3285",
                    "scriptHash": "483788748bd6129043bfc87fba9c0b5bc7e49b892efdc9dd783e3285",
                    "contractAddress": "addr1w9yr0zr530tp9yzrhly8lw5upddu0eym3yh0mjwa0qlr9pgmkzgv0"
                }
            ]
        },
        {
            "id": "0fm9UZ",
            "name": "Direct sale",
            "purpose": "SPEND",
            "type": "PLUTUS",
            "versions": [
                {
                    "version": 1,
                    "plutusVersion": 1,
                    "fullScriptHash": "71cb08fd2cf22dc45b23a7ff9c03468d94c93133606ba2abfdc833a76a",
                    "scriptHash": "cb08fd2cf22dc45b23a7ff9c03468d94c93133606ba2abfdc833a76a",
                    "contractAddress": "addr1w89s3lfv7gkugker5llecq6x3k2vjvfnvp4692laeqe6w6s93vj3j"
                }
            ]
        },
        {
            "id": "70V28B",
            "name": "Escrow",
            "purpose": "SPEND",
            "type": "PLUTUS",
            "versions": [
                {
                    "version": 1,
                    "plutusVersion": 1,
                    "fullScriptHash": "718ea445f8c91b71a539d276d4fa6002ca2df1d9edac3ceff987d8c7b4",
                    "scriptHash": "8ea445f8c91b71a539d276d4fa6002ca2df1d9edac3ceff987d8c7b4",
                    "contractAddress": "addr1wx82g30ceydhrffe6fmdf7nqqt9zmuweakkremleslvv0dqw3qmft"
                }
            ]
        },
        {
            "id": "VCuTLw",
            "name": "Exchanger",
            "purpose": "SPEND",
            "type": "PLUTUS",
            "versions": [
                {
                    "version": 1,
                    "plutusVersion": 1,
                    "fullScriptHash": "71438a0728b3fa87565f2afd0d97e3eba82471d98da138cdffb5fe9121",
                    "scriptHash": "438a0728b3fa87565f2afd0d97e3eba82471d98da138cdffb5fe9121",
                    "contractAddress": "addr1w9pc5pegk0agw4jl9t7sm9lraw5zguwe3ksn3n0lkhlfzggtt48g9"
                }
            ]
        },
        {
            "id": "116Z4E",
            "purpose": "MINT",
            "type": "PLUTUS",
            "versions": [
                {
                    "mintPolicyID": "9902279d9e834859a5fca5b9a334d070aa1ae686be2f49407aae5ea9",
                    "plutusVersion": 1,
                    "version": 3
                }
            ]
        }
    ]
}
