{
    "id": "3Cvyqvxc",
    "projectName": "Filthy Rich Horses",
    "link": "https://www.filthyrichhorses.com",
    "twitter": "https://twitter.com/FRHorses",
    "category": "MARKETPLACE",
    "subCategory": "NFT",
    "description": {
        "short": "An NFT collection and one of the first projects to implement a smart contract marketplace"
    },
    "releases": [
        {
            "releaseNumber": 1,
            "releaseName": "V1",
            "scripts": [
                {
                    "id": "NMkwXk",
                    "version": 1
                }
            ]
        }
    ],
    "contracts": [
        {
            "openSource": false
        }
    ],
    "scripts": [
        {
            "id": "NMkwXk",
            "purpose": "SPEND",
            "versions": [
                {
                    "version": 1,
                    "plutusVersion": 1,
                    "fullScriptHash": "716da02e1defd1a038d6ed36466a16cc19a14efa59025e4a156be6d020",
                    "scriptHash": "6da02e1defd1a038d6ed36466a16cc19a14efa59025e4a156be6d020",
                    "contractAddress": "addr1w9k6qtsaalg6qwxka5myv6skesv6znh6typ9ujs4d0ndqgqpad9he"
                }
            ]
        }
    ]
}
