{
    "id": "oAjWWxbN",
    "projectName": "Plutus.Art",
    "link": "https://www.plutus.art",
    "twitter": "https://twitter.com/plutus_art",
    "category": "MARKETPLACE",
    "subCategory": "NFT",
    "description": {
        "short": "A highly-curated platform for creating, collecting and trading unique NFTs on Cardano blockchain."
    },
    "releases": [
        {
            "releaseNumber": 1,
            "releaseName": "V1",
            "scripts": [
                {
                    "id": "qdCSie",
                    "version": 1
                },
                {
                    "id": "IKVjuA",
                    "version": 1
                },
                {
                    "id": "c34FTS",
                    "version": 1
                },
                {
                    "id": "tGTw6i",
                    "version": 1
                },
                {
                    "id": "SerMlk",
                    "version": 1
                }
            ]
        }
    ],
    "contracts": [
        {
            "openSource": false
        }
    ],
    "scripts": [
        {
            "id": "qdCSie",
            "name": "Marketplace",
            "purpose": "SPEND",
            "type": "PLUTUS",
            "versions": [
                {
                    "version": 1,
                    "plutusVersion": 2,
                    "fullScriptHash": "11b2b837d414f9a25899e8e8a8c8d4e0c3aedf61fd819db60cf4f2f96f8c1d8b49ff1ffe46d4386b7ac858fff8ff27cb6fb159d7da90c93d5e",
                    "scriptHash": "b2b837d414f9a25899e8e8a8c8d4e0c3aedf61fd819db60cf4f2f96f8c1d8b49ff1ffe46d4386b7ac858fff8ff27cb6fb159d7da90c93d5e",
                    "contractAddress": "addr1zxetsd75znu6ykyear523jx5urp6ahmplkqemdsv7ne0jmuvrk95nlcllerdgwrt0ty93llclunukma3t8ta4yxf840qqklyer"
                }
            ]
        },
        {
            "id": "IKVjuA",
            "purpose": "SPEND",
            "type": "PLUTUS",
            "versions": [
                {
                    "version": 1,
                    "plutusVersion": 2,
                    "fullScriptHash": "11b7bd6afb4252f81a9624337225ff0ad9a54dee3f6efa6b0a2c55473d8c1d8b49ff1ffe46d4386b7ac858fff8ff27cb6fb159d7da90c93d5e",
                    "scriptHash": "b7bd6afb4252f81a9624337225ff0ad9a54dee3f6efa6b0a2c55473d8c1d8b49ff1ffe46d4386b7ac858fff8ff27cb6fb159d7da90c93d5e",
                    "contractAddress": "addr1zxmm66hmgff0sx5kysehyf0lptv62n0w8ah056c29325w0vvrk95nlcllerdgwrt0ty93llclunukma3t8ta4yxf840qlykcrp"
                }
            ]
        },
        {
            "id": "c34FTS",
            "purpose": "SPEND",
            "type": "PLUTUS",
            "versions": [
                {
                    "version": 1,
                    "plutusVersion": 2,
                    "fullScriptHash": "1118088a02e4b0dc79e8c8ded7b0969e67c8389676eecd66b621609e998c1d8b49ff1ffe46d4386b7ac858fff8ff27cb6fb159d7da90c93d5e",
                    "scriptHash": "18088a02e4b0dc79e8c8ded7b0969e67c8389676eecd66b621609e998c1d8b49ff1ffe46d4386b7ac858fff8ff27cb6fb159d7da90c93d5e",
                    "contractAddress": "addr1zyvq3zszujcdc70ger0d0vyknenuswykwmhv6e4ky9sfaxvvrk95nlcllerdgwrt0ty93llclunukma3t8ta4yxf840qet2tj3"
                }
            ]
        },
        {
            "id": "tGTw6i",
            "name": "TREASURYWITNESS",
            "purpose": "MINT",
            "type": "PLUTUS",
            "versions": [
                {
                    "mintPolicyID": "fd674aef17ba01a780ed9607a36af8f599c0ccd42ad19be4e95d8d92",
                    "plutusVersion": 1,
                    "version": 1
                }
            ]
        },
        {
            "id": "SerMlk",
            "purpose": "MINT",
            "type": "PLUTUS",
            "versions": [
                {
                    "mintPolicyID": "e74efba5a59213aa38fbbd7585e8fc69277f0081e750fc6ed4c33354",
                    "plutusVersion": 1,
                    "version": 1
                }
            ]
        }
    ]
}
