{
    "id": "jIc6Frxi",
    "projectName": "Orcfax",
    "link": "https://orcfax.io",
    "twitter": "https://twitter.com/orcfax",
    "category": "DEFI",
    "subCategory": "ORACLE",
    "description": {
        "short": "Decentralized oracle feeds for Cardano smart contracts"
    },
    "releases": [
        {
            "releaseNumber": 1,
            "releaseName": "V1",
            "scripts": [
                {
                    "id": "r0HIW1",
                    "version": 1
                },
                {
                    "id": "7cNhdj",
                    "version": 1
                },
                {
                    "id": "X4VKyR",
                    "version": 1
                },
                {
                    "id": "BXpeY8",
                    "version": 1
                },
                {
                    "id": "06sXor",
                    "version": 1
                }
            ]
        }
    ],
    "contracts": [
        {
            "openSource": false
        }
    ],
    "scripts": [
        {
            "id": "r0HIW1",
            "name": "Feed",
            "purpose": "SPEND",
            "type": "PLUTUS",
            "versions": [
                {
                    "version": 1,
                    "plutusVersion": 2,
                    "fullScriptHash": "71d78ce124f4c3183782994a94f18701950e9d85f7bef303e7c77df459",
                    "scriptHash": "d78ce124f4c3183782994a94f18701950e9d85f7bef303e7c77df459",
                    "contractAddress": "addr1w8tcecfy7np3sduzn99ffuv8qx2sa8v977l0xql8ca7lgkgq7lqh2"
                }
            ]
        },
        {
            "id": "7cNhdj",
            "purpose": "SPEND",
            "type": "PLUTUS",
            "versions": [
                {
                    "version": 1,
                    "plutusVersion": 2,
                    "fullScriptHash": "7128ba0bba6fc7bea013932f3014b000ec2844dfb4f7da3e8f463fbca8",
                    "scriptHash": "28ba0bba6fc7bea013932f3014b000ec2844dfb4f7da3e8f463fbca8",
                    "contractAddress": "addr1wy5t5za6dlrmagqnjvhnq99sqrkzs3xlknma5050gclme2q7ksjkd"
                }
            ]
        },
        {
            "id": "X4VKyR",
            "purpose": "MINT",
            "type": "PLUTUS",
            "versions": [
                {
                    "mintPolicyID": "2cccc05192920ff1eb02bcfa7bb2a1fc5352ce58391d7ba3c66a555b",
                    "plutusVersion": 2,
                    "version": 1
                }
            ]
        },
        {
            "id": "BXpeY8",
            "purpose": "MINT",
            "type": "PLUTUS",
            "versions": [
                {
                    "mintPolicyID": "84da51fd8041b6a1073f1154ddde0c846d71c4081fc1f7ba66e0e6b5",
                    "plutusVersion": 2,
                    "version": 1
                }
            ]
        },
        {
            "id": "06sXor",
            "purpose": "MINT",
            "type": "PLUTUS",
            "versions": [
                {
                    "mintPolicyID": "e51a6cc459080aa690e32cccb20701dda601f604d5573dc8290c58a8",
                    "plutusVersion": 2,
                    "version": 1
                }
            ]
        }
    ]
}
